{"schema_version":"1.0.0","proposal_id":"CP-0001","scope":"project:novel_example","classification":"CHARACTER_STATE_DRIFT","observed_review_ids":["review-ep001","review-ep002","review-ep003"],"change_target":"retrieval","minimal_diff":"Require current character_state in drafting Evidence Packs.","expected_effect":"reduce character state omissions","risk_level":"low","evaluation_plan":["replay the three observed reviews","run critical regressions","run one canary task"],"rollback_version":"context-router@1.0.0","status":"proposed","approvals":{"candidate":{"status":"pending","approval_id":"","approved_by":""},"promotion":{"status":"pending","approval_id":"","approved_by":""}},"replay":{"status":"pending","current_score":null,"candidate_score":null,"regressions":[]},"canary":{"task_limit":1,"completed_tasks":0,"status":"pending"}}
